Code,CVX CODE,МНН,SNOMED,RELATIONSHIP,SNOMED Descriptions,UZ,RU,EN,,,,
immun-79,  109,J07AL,  12866006,equivalent,Administration of vaccine product containing only Streptococcus pneumoniae antigen (procedure),"pnevmokokkka qarshi emlash, aniqlanmagan","пневмококковая вакцина, неуточненная формулировка","pneumococcal vaccine, unspecified formulation",,,,
immun-80,  70,J07AX02,871723002,equivalent,Vaccine product containing only Coxiella burnetii antigen (medicinal product),Ku isitmasi vaktsinasi,вакцина против лихорадки Ку,Q fever vaccine,,,,
immun-81,  18,J07BG01,1131000221109,equivalent,Vaccine product containing only inactivated whole Rabies lyssavirus antigen (medicinal product),"quturganga qarshi emlash, mushak ichiga yuborish uchun OLD CODE","вакцина против бешенства, для внутримышечной инъекции СТАРЫЙ КОД","rabies vaccine, for intramuscular injection RETIRED CODE",,,,
immun-82,  40,J07BG,1131000221109,equivalent,Vaccine product containing only inactivated whole Rabies lyssavirus antigen (medicinal product),"quturishga qarshi emlash, intradermal in'ektsiya uchun","вакцина против бешенства, для внутрикожной инъекции","rabies vaccine, for intradermal injection",,,,
immun-83,  90,J07BG,871726005,equivalent,Rabies lyssavirus antigen only vaccine product,"quturishga qarshi emlash, aniqlanmagan","вакцина против бешенства, неуточненная формулировка","rabies vaccine, unspecified formulation",,,,
immun-84,  72,,121096003,source-is-narrower-than-target,Streptococcus pyogenes antigen,revmatik isitmaga qarshi emlash,вакцина против ревматической лихорадки,rheumatic fever vaccine,,,,
immun-85,  73,J07BX,709177003,source-is-narrower-than-target,Rift valley fever virus Ag,Rift vodiysi isitmasi vaktsinasi,Вакцина против лихорадки долины Рифт,Rift Valley fever vaccine,,,,
immun-86,  34,J06BB05,422303009,equivalent,Rabies immune globulin,quturgan immunoglobulini,иммуноглобулин против бешенства,rabies immune globulin,,,,
immun-87,  119,J07BH01,871761004,equivalent,Rotavirus antigen only vaccine produc,"rotavirus vaktsinasi, jonli, monovalent","ротавирусная вакцина, живая, моновалентная","rotavirus, live, monovalent vaccine",,,,
immun-88,  122,"J07BH
",836387005,equivalent,Rotavirus antigen-containing vaccine product,"rotavirusga qarshi emlash, aniqlanmagan","ротавирусная вакцина, неуточненная формулировка","rotavirus vaccine, unspecified formulation",,,,
immun-89,  116,J07BH02,  871761004,source-is-narrower-than-target,Rotavirus antigen only vaccine product,"rotavirus, jonli, pentavalent vaktsina","ротавирус, живой, пятивалентная вакцина","rotavirus, live, pentavalent vaccine",,,,
immun-90,  74,J07BH02,1081000221109,source-is-narrower-than-target,Live attenuated Rotavirus antigen only vaccine produc,"rotavirus, jonli, to'rt vaktsina","ротавирус, живой, четырехвалентная вакцина","rotavirus, live, tetravalent vaccine",,,,
immun-91,  71,,117090003,equivalent,"Respiratory syncytial virus immune globulin, human, administration by intravascular infusion","respirator sinsitial virus immunoglobulini, tomir ichiga yuborish","иммуноглобулин против респираторно-синцитиального вируса, внутривенный","respiratory syncytial virus immune globulin, intravenous",,,,
immun-92,  93,J06BB16,777050007,equivalent,Product containing only palivizumab (medicinal product),"respirator sinsitial virus monoklonal antikor (palivizumab), mushak ichiga","моноклональное антитело к респираторно-синцитиальному вирусу (паливизумаб), внутримышечно","respiratory syncytial virus monoclonal antibody (palivizumab), intramuscular",,,,
immun-93,  06,J07BJ01,  871732000,equivalent,Rubella virus antigen only vaccine product,qizilcha virusiga qarshi emlash,вакцина против вируса краснухи,rubella virus vaccine,,,,
immun-94,  38,"J07BD53
",571591000119106,source-is-narrower-than-target,"Administration of live attenuated measles, mumps, and rubella vaccine",qizilcha va parotit virusiga qarshi emlash,вакцина против вируса краснухи и паротита,rubella and mumps virus vaccine,,,,
immun-95,  76,,3092008,source-is-narrower-than-target,Staphylococcus aureus (organism),stafilokokk bakteriofag lizati,лизат бактериофага стафилококка,Staphylococcus bacteriophage lysate,,,,
immun-96,  113,J07AM51,2031000221103,equivalent,Clostridium tetani and Corynebacterium diphtheriae toxoids only adult vaccine product,"qoqshol va difteriya toksoidlari, adsorbsiyalangan, konservantlarsiz, kattalar uchun (5 l tetanus va 2 l difteriya toksoidi)","столбнячный и дифтерийный токсоиды, адсорбированные, без консервантов, для взрослого применения (5 л столбнячного токсоида и 2 л дифтерийного токсоида)","tetanus and diphtheria toxoids, adsorbed, preservative free, for adult use (5 Lf of tetanus toxoid and 2 Lf of diphtheria toxoid)",,,,
immun-97,  09,J07AM51,2031000221103,equivalent,Clostridium tetani and Corynebacterium diphtheriae toxoids only adult vaccine product,"qoqshol va difteriya toksoidlari, adsorbsiyalangan, konservantlarsiz, kattalar uchun (2 Lf tetanus va 2 Lf difteriya toksoidi)","столбнячный и дифтерийный токсоиды, адсорбированные, без консервантов, для взрослого применения (2 Lf столбнячного токсоида и 2 Lf дифтерийного токсоида)","tetanus and diphtheria toxoids, adsorbed, preservative free, for adult use (2 Lf of tetanus toxoid and 2 Lf of diphtheria toxoid)",,,,
immun-98,  115,J07AM01,2081000221102,source-is-narrower-than-target,"Pediatric vaccine product containing only acellular Bordetella pertussis, Clostridium tetani and Corynebacterium diphtheriae toxoids, Haemophilus influenzae type b capsular polysaccharide conjugated, Hepatitis B virus surface antigens (medicinal product)","tetanoz, difteriya toksini va hujayrali ko'kyo'talga qarshi emlash, adsorbsiyalangan","вакцина против столбняка, дифтерийного токсина и ацеллюлярного коклюша, адсорбированная","tetanus toxoid, reduced diphtheria toxoid, and acellular pertussis vaccine, adsorbed",,,,
immun-99,  35,J07AM01,2021000221101,equivalent,Vaccine product containing only Clostridium tetani toxoid (medicinal product),"tetanus toksoidi, adsorbsiyalangan","столбнячный анатоксоид, адсорбированный","tetanus toxoid, adsorbed",,,,
immun-100,  112,J07AM,2021000221101,equivalent,Vaccine product containing only Clostridium tetani toxoid (medicinal product),"tetanoz toksoidi, aniqlanmagan","столбнячный токсоид, неуточненная формулировка","tetanus toxoid, unspecified formulation",,,,
immun-101,  77,J07BA01, 871719005,equivalent,Tick-borne encephalitis virus antigen only vaccine produc,Shomil ensefalitiga qarshi emlash (AQShdan tashqari),Вакцина против клещевого энцефалита (не США),tick-borne encephalitis vaccine,,,,
immun-102,  13,J06BB02,  117091004,equivalent,"Tetanus immune globulin, human, issued (situation)",tetanoz immunoglobulini,столбнячный иммуноглобулин,tetanus immune globulin,,,,
immun-103,  95,V04CF,424294008,source-is-narrower-than-target, Delayed hypersensitivity skin test for tuberculin purified protein derivative (procedure),"tuberkulin teri testi; eski tuberkulin, ko'p teshikli qurilma","туберкулиновая кожная проба; старый туберкулин, многопункционное устройство","tuberculin skin test; old tuberculin, multipuncture device",,,,
immun-104,  96,V04CF,424294008,source-is-narrower-than-target,Delayed hypersensitivity skin test for tuberculin purified protein derivative (procedure),"tuberkulin teri testi; tozalangan protein lotin eritmasi, intradermal","туберкулиновая кожная проба; очищенный раствор производного белка, внутрикожно","tuberculin skin test; purified protein derivative solution, intradermal",,,,
immun-105,  97,V04CF,424294008,source-is-narrower-than-target,Delayed hypersensitivity skin test for tuberculin purified protein derivative (procedure),"tuberkulin teri testi; tozalangan oqsil hosilasi, ko'p teshikli qurilma","туберкулиновая кожная проба; очищенное производное белка, многопункционный прибор","tuberculin skin test; purified protein derivative, multipuncture device",,,,
immun-106,  98,V04CF,424294008,source-is-narrower-than-target,Delayed hypersensitivity skin test for tuberculin purified protein derivative (procedure),tuberkulin teri testi; aniqlanmagan formula,туберкулиновая кожная проба; неуточненная формула,tuberculin skin test; unspecified formulation,,,,
immun-107,  78,J07AX,871716003,equivalent,Francisella tularensis antigen only vaccine product,tulyaremiyaga qarshi emlash,вакцина против туляремии,tularemia vaccine,,,,
immun-108,  91,J07AP,961000221100,equivalent,typhoid vaccine,"tifga qarshi emlash, aniqlanmagan","вакцина против брюшного тифа, неуточненная формулировка","typhoid vaccine, unspecified formulation",,,,
immun-109,  25,J07AP01,961000221100,source-is-narrower-than-target,Vaccine product containing only Salmonella enterica subspecies enterica serovar Typhi antigen (medicinal product),"tifga qarshi emlash, jonli, og'iz","вакцина против брюшного тифа, живая, пероральная","typhoid vaccine, live, oral",,,,
immun-110,  41,"J07AP03 
",961000221100,source-is-narrower-than-target,Vaccine product containing Salmonella enterica subspecies enterica serovar Typhi antigen (medicinal product),"tifoid vaktsina, parenteral, aseton bilan o'ldirilgandan tashqari, quritilgan","вакцина против брюшного тифа, парентеральная, кроме убитой ацетоном, высушенная","typhoid vaccine, parenteral, other than acetone-killed, dried",,,,
immun-111,  53,J07AP02,961000221100,source-is-narrower-than-target,Vaccine product containing Salmonella enterica subspecies enterica serovar Typhi antigen (medicinal product),"Tifoga qarshi emlash, parenteral, aseton o'ldirilgan, quritilgan (AQSh harbiylari)","вакцина против брюшного тифа, парентеральная, убитая ацетоном, высушенная (военные США)","typhoid vaccine, parenteral, acetone-killed, dried (U.S. military)",,,,
immun-112,  101,J07AP03, 871755002,equivalent,Vaccine product containing only Salmonella enterica subspecies enterica serovar Typhi capsular polysaccharide Vi antigen (medicinal product),"Qorin tifiga qarshi emlash, kapsulali polisaxarid Vi",капсульная полисахаридная вакцина против брюшного тифа Vi,typhoid Vi capsular polysaccharide vaccine,,,,
immun-113,  75,J07BX,871727001,equivalent,Vaccine product containing only Vaccinia virus antigen (medicinal product),Chechakka qarshi emlash (chechakka qarshi vaktsina),вакцина против оспы (вакцина против оспы),vaccinia (smallpox) vaccine,,,,
immun-114,  105,J07BX,871727001,equivalent,Vaccine product containing only Vaccinia virus antigen (medicinal product),"Chechakka qarshi emlash, suyultirilgan","вакцина против оспы, разведенная","vaccinia (smallpox) vaccine, diluted",,,,
immun-115,  79,J06,717220006,equivalent,Vaccinia human immune globulin (substance),immunoglobulin vaktsinasi,иммуноглобулин вакцины,vaccinia immune globulin,,,,
immun-116,  21,"J07BJ01 
",836385002,not-mapped,Vaccine product containing Yellow fever virus antigen (medicinal product),varikella-zoster vaktsinasi,вакцина против вируса ветряной оспы,varicella virus vaccine,,,,
immun-117,  81,J07AX, 836403007,not-mapped,Vaccine product containing Tick-borne encephalitis virus antigen (medicinal product),"Venesuela ot ensefaliti, faolsizlangan","Венесуэльский энцефалит лошадей, инактивированная","Venezuelan equine encephalitis, inactivated",,,,
immun-118,  80,J07AX,121093006,source-is-narrower-than-target, Antigen of Venezuelan equine encephalitis virus (substance),"Venesuela ot ensefaliti, jonli, zaiflashgan","Венесуэльский конский энцефалит, живой, аттенуированный","Venezuelan equine encephalitis, live, attenuated",,,,
immun-119,  92,J07AX,836403007,not-mapped,Vaccine product containing Tick-borne encephalitis virus antigen (medicinal product),"Venesuela ot ensefalitiga qarshi emlash, aniqlanmagan formulasi","Вакцина против венесуэльского конского энцефалита, неуточненная формула","Venezuelan equine encephalitis vaccine, unspecified formulation",,,,
immun-120,  36,J06BB,777919007,equivalent,Product containing only Varicella-zoster virus antibody (medicinal product),herpes zosterga qarshi immunoglobulin,иммуноглобулин против опоясывающего лишая,varicella zoster immune globulin,,,,
immun-121,  117,,62294009,source-is-narrower-than-target,Product containing Varicella-zoster virus antibody (medicinal product),zoster immun globulin (yangi tadqiqot preparati),иммуноглобулин против опоясывающего лишая (новый исследуемый препарат),varicella zoster immune globulin (Investigational New Drug),,,,
immun-122,  37,J07BL01,836385002,equivalent,Vaccine product containing Yellow fever virus antigen (medicinal product,"sariq isitmaga qarshi emlash, jonli",вакцина против желтой лихорадки живая,yellow fever vaccine,,,,
immun-123,  121,J07BK02,836389008,not-mapped,Vaccine product containing Vaccinia virus antigen (medicinal product),"zoster vaktsinasi, jonli","вакцина против опоясывающего лишая, живая","zoster vaccine, live",,,,
immun-124,  998,,1296689002,equivalent,Vaccine product full volume not administered (finding),vaktsina berilmagan,вакцина не вводилась,no vaccine administered,,,,
immun-125,  999,,51116004,source-is-narrower-than-target,Passive immunization (procedure),noma'lum vaktsina yoki immun globulin,неизвестная вакцина или иммуноглобулин,unknown vaccine or immune globulin,,,,
immun-126,  99,,1256105002,not-mapped,Reserved,zaxiralangan - foydalanmang,зарезервировано - не использовать,RESERVED - do not use,,,,
immun-127,  133,J07AL02,51451000087105,equivalent,"Vaccine product containing only Streptococcus pneumoniae Danish serotype 1, 3, 4, 5, 6A, 6B, 7F, 9V, 14, 18C, 19A, 19F, and 23F capsular polysaccharide antigens conjugated (medicinal product)","pnevmokokk konjugat vaktsinasi, 13 valentli","пневмококковая конъюгированная вакцина, 13 валентная","pneumococcal conjugate vaccine, 13 valent",,,,
immun-128,  134,J07BA02,871724008,equivalent,Vaccine product containing only Japanese encephalitis virus antigen (medicinal product),Mushak ichiga yuborish uchun yapon ensefalitiga qarshi emlash,Вакцина против японского энцефалита для внутримышечного введения,Japanese Encephalitis vaccine for intramuscular administration,,,,
immun-129,  137,J07BM,836379009,equivalent,Human papillomavirus antigen-containing vaccine product,"HPV, aniqlanmagan formulasi","ВПЧ, неуточненная формулировка","HPV, unspecified formulation",,,,
immun-130,  136,"J07AH08 
",836402002,not-mapped,Bacillus Calmette-Guerin antigen-containing vaccine product,"meningokokk oligosakkarid (A, C, Y va W-135 guruhlari) difteriya toksoid konjugat vaktsinasi (MCV4O)","менингококковая олигосахаридная (группы A, C, Y и W-135) дифтерийно-токсоидная конъюгированная вакцина (MCV4O)","meningococcal oligosaccharide (groups A, C, Y and W-135) diphtheria toxoid conjugate vaccine (MCV4O)",,,,
immun-131,  135,J07BB01,229978006,not-mapped,Food preservative-free food,"Gripp, yuqori dozali, split virus, trivalent, in'ektsion, konservantsiz","Гриппозная, высокодозная, расщепленный вирус, трехвалентная, инъекционная, без консервантов","influenza, high dose seasonal, preservative-free",,,,
immun-132,  131,, 30338008,source-is-narrower-than-target,Typhus vaccination,Tifoga qarshi emlashning tarixiy rekordi,Историческая запись о вакцинации против сыпного тифа,Historical record of a typhus vaccination,,,,
immun-133,  132,J07CA,871895005,equivalent,Vaccine product containing only Bordetella pertussis and Clostridium tetani and Corynebacterium diphtheriae and Haemophilus influenzae type b and Hepatitis B virus and Human poliovirus antigens (medicinal product),"Difteriya va qoqshol, hujayrasiz ko'kyo'tal, poliovirus, Haemophilus influenzae b konjugati va gepatit B (rekombinant) ga qarshi emlashning tarixiy rekordi.","Историческая запись о вакцинации против дифтерии и столбняка, ацеллюлярного коклюша, полиовируса, конъюгата гемофильной палочки b и гепатита B (рекомбинантная).","Historical diphtheria and tetanus toxoids and acellular pertussis, poliovirus, Haemophilus b conjugate and hepatitis B (recombinant) vaccine.",,,,
immun-134,  128,J07BB,836377006,source-is-narrower-than-target,Vaccine product containing influenza virus antigen (medicinal product),"Eng yangi gripp-H1N1-09, barcha formulalar","Новейший грипп-H1N1-09, все формулы","Novel influenza-H1N1-09, all formulations",,,,
immun-135,  125,J07BB03,1181000221105,equivalent,Vaccine product containing only Influenza A virus antigen (medicinal product),"Eng yangi gripp-H1N1-09, burundan foydalanish uchun jonli virus","Новейший грипп-H1N1-09, живой вирус для назального применения","Novel Influenza-H1N1-09, live virus for nasal administration",,,,
immun-136,  126,J07BB,442696006,source-is-narrower-than-target,Influenza A H1N1,"Eng yangi gripp-H1N1-09, konservantlarsiz, in'ektsiya","Новейший грипп-H1N1-09, без консервантов, инъекционная","Novel influenza-H1N1-09, preservative-free, injectable",,,,
immun-137,  127,J07BB,442696006,source-is-narrower-than-target,Influenza A H1N1,"Yangi gripp-H1N1-09, in'ektsiya uchun","Новый грипп-H1N1-09, инъекционный","Novel influenza-H1N1-09, injectable",,,,
immun-138,  138,J07AM,2031000221103,equivalent,Clostridium tetani and Corynebacterium diphtheriae toxoids only adult vaccine product,"tetanoz va difteriya toksoidlari, adsorbsiyalanmagan, kattalar uchun foydalanish uchun","столбнячный и дифтерийный токсоиды, не адсорбированные, для взрослого применения","tetanus and diphtheria toxoids, not adsorbed, for adult use",,,,
immun-139,  139,J07AM,871826000,equivalent,Vaccine product containing only Clostridium tetani and Corynebacterium diphtheriae antigens (medicinal product),Td (kattalar uchun) aniqlanmagan formula,Td(взрослый) неуточненная формула,Td(adult) unspecified formulation,,,,
immun-140,  140,J07BB01,1181000221105,equivalent,Vaccine product containing only influenza virus antigen (medicinal product),"Gripp, split virus, trivalent, in'ektsiya, konservantsiz","Гриппозная, расщепленный вирус, трехвалентная, инъекционная, без консервантов","Influenza, seasonal, injectable, preservative free",,,,
immun-141,  129,J07BA,871724008,equivalent,Vaccine product containing only Japanese encephalitis virus antigen (medicinal product),"Yapon ensefalitiga qarshi emlash, aniqlanmagan formulasi","Вакцина против японского энцефалита, неуточненная формулировка","Japanese Encephalitis vaccine, unspecified formulation",,,,
immun-142,  141,J07BB01,1181000221105,source-is-narrower-than-target,Vaccine product containing only influenza virus antigen (medicinal product),"Gripp, split virus, trivalent, in'ektsiya, konservantni o'z ichiga oladi","Гриппозная, расщепленный вирус, трехвалентная, инъекционная, содержит консервант","Influenza, seasonal, injectable",,,,
immun-143,  142,J07AM,871742003,equivalent,Vaccine product containing only Clostridium tetani antigen (medicinal product),"tetanus toksoidi, adsorbsiyalanmagan","столбнячный токсоид, не адсорбированный","tetanus toxoid, not adsorbed",,,,
immun-144,  143,J07AX,871722007,source-is-narrower-than-target, Vaccine product containing only Adenovirus antigen (medicinal product),"Adenovirus, 4-toifa va 7-toifa, jonli, og'zaki","Аденовирус, тип 4 и тип 7, живой, пероральный","Adenovirus, type 4 and type 7, live, oral",,,,
immun-145,  144,J07BB,1181000221105,source-is-narrower-than-target,Vaccine product containing only influenza virus antigen (medicinal product),"mavsumiy gripp, intradermal, konservantlarsiz","сезонный грипп, внутрикожно, без консервантов","seasonal influenza, intradermal, preservative free",,,,
immun-146,  145,,386900007,source-is-narrower-than-target,Palivizumab (substance),"respirator sinsitial virusga monoklonal antikor (motavizumab), mushak ichiga","моноклональное антитело к респираторно-синцитиальному вирусу (мотавизумаб), внутримышечно","respiratory syncytial virus monoclonal antibody (motavizumab), intramuscular",,,,
immun-147,  146,"J07CA
",871895005,equivalent,Vaccine product containing only Bordetella pertussis and Clostridium tetani and Corynebacterium diphtheriae and Haemophilus influenzae type b and Hepatitis B virus and Human poliovirus antigens (medicinal product),"Difteriya va qoqshol toksoidlari va adsorbsiyalangan hujayrali ko'k yo'tal, inaktivatsiyalangan poliovirus, Haemophilus influenzae b konjugati (meningokokk oqsil konjugati) va gepatit B vaktsinasi (rekombinant).","Токсоиды дифтерии и столбняка и ацеллюлярный коклюш адсорбированные, инактивированный полиовирус, конъюгат гемофильной палочки b (конъюгат менингококкового белка) и вакцина против гепатита B (рекомбинантная).","Diphtheria and Tetanus Toxoids and Acellular Pertussis Adsorbed, Inactivated Poliovirus, Haemophilus b Conjugate (Meningococcal Protein Conjugate), and Hepatitis B (Recombinant) Vaccine.",,,,
immun-148,  147,J07AH08,871873006,equivalent,"Vaccine product containing only Neisseria meningitidis serogroup A, C, W135 and Y antigens (medicinal product)","Meningokokk, MCV4, aniqlanmagan konjugat formulasi (A, C, Y va W-135 guruhlari)","Менингококковая, MCV4, неуточненная конъюгированная формула (группы A, C, Y и W-135)","Meningococcal, MCV4, unspecified conjugate formulation(groups A, C, Y and W-135)",,,,
immun-149,  148,J07AG53,1119351006,equivalent,Vaccine product containing only Haemophilus influenzae type b and Neisseria meningitidis serogroup C and Y antigens (medicinal product),Meningokokk konjugat vaktsinasi C va Y guruhlari va tetanoz konjugati vaktsina b,Конъюгированная менингококковая вакцина групп C и Y и конъюгированная вакцина против столбняка b,Meningococcal Groups C and Y and Haemophilus b Tetanus Toxoid Conjugate Vaccine,,,,
immun-150,  149,J07BB03,1181000221105,source-is-narrower-than-target,Vaccine product containing only influenza virus antigen (medicinal product),"Gripp, jonli, to'rt valentli, intranazal","Гриппозная, живая, четырехвалентная, интраназальная","influenza, live, intranasal, quadrivalent",,,,
